procurement_id,issuing_agency,agency_type,agency_location,country,contract_title,contract_category,naics_code,estimated_contract_value,incumbent_vendor,contract_duration,bid_open_date,bid_close_date,renewal_date,last_award_date,submission_requirements,procurement_portal,contact_email,contact_phone,vendor_dependencies,operational_weakness,automation_opportunity,recurring_revenue_potential,prime_pathwy_priority,data_date,source
PROC-01459,NHS Supply Chain,Healthcare,"Alfreton, ENG",UK,Custodial Services Contract — NHS Supply Chain,Janitorial & Custodial Services,562111,"$25,000,000+",ABM Industries Inc.,2 Years,2026-08-19,2026-09-14,2027-11-06,2026-05-06,"Bid Bond (5%), Performance Bond (100%), Payment Bond (100%), NAICS Certification",https://www.nhssupplychain.nhs.uk,enquiries@nhssupplychain.nhs.uk,+44 345 600 8600,Primary: ABM Industries Inc.; Secondary: Regional subcontractors,Incumbent lacks digital reporting capability — tech upgrade opportunity,Spreadsheet-based vendor management — CRM integration opportunity,"$7,500/mo",WATCH — 90+ Days,2026-05-29,Prime Pathwy Procurement Intelligence Engine v2.0
PROC-01462,Highways England (National Highways),Infrastructure,"Birmingham, ENG",UK,Uniformed Security Guard Services — Highways England (National Highways),Security Guard Services,493110,"$300,000–$500,000",ServiceMaster Clean,1 Year + 4 Options,2026-07-01,2026-07-30,2026-10-24,2025-11-01,"RFP Response, ISO 9001 Certification, Environmental Compliance Documentation",https://nationalhighways.co.uk/industry-information/procurement/,procurement@nationalhighways.co.uk,+44 300 123 5000,Primary: ServiceMaster Clean; Secondary: Regional subcontractors,Contract approaching renewal — 90-day window to position,Paper-based compliance tracking — digitization opportunity worth $50K+/yr,"$15,000/mo",MEDIUM — 60-Day Pipeline,2026-05-29,Prime Pathwy Procurement Intelligence Engine v2.0
PROC-01463,City of Vancouver — Procurement Services,Municipal,"Vancouver, BC",CA,Uniformed Security Guard Services — City of Vancouver,Security Guard Services,541513,"$300,000–$500,000",Adecco Group,5 Years + 2 Options,2026-08-23,2026-10-23,2026-11-17,2024-11-25,"Technical Proposal, Price Schedule, Organizational Chart, Key Personnel Resumes",https://vancouver.ca/doing-business/procurement.aspx,procurement@vancouver.ca,+1 (604) 873-7000,Primary: Adecco Group; Secondary: Regional subcontractors,New agency director — procurement philosophy shift expected,Paper timesheets — digital workforce management opportunity,"$7,500/mo",HIGH — Prepare in 30 Days,2026-05-29,Prime Pathwy Procurement Intelligence Engine v2.0
PROC-01466,Toronto Transit Commission (TTC) — Procurement,Transit,"Toronto, ON",CA,Facilities Maintenance & Repair Services — Toronto Transit Commission (TTC),Facilities Maintenance & Repair,541513,"$10,000,000–$25,000,000",Leidos Holdings Inc.,3 Years + 2 Options,2026-07-11,2026-09-15,2026-10-12,2024-09-11,"Technical Proposal, Price Schedule, Organizational Chart, Key Personnel Resumes",https://www.ttc.ca/doing-business-with-ttc,procurement@ttc.ca,+1 (416) 393-4000,Primary: Leidos Holdings Inc.; Secondary: Regional subcontractors,New agency director — procurement philosophy shift expected,Email-based bid notifications — automated alert system opportunity,"$7,500/mo",CRITICAL — Bid Now,2026-05-29,Prime Pathwy Procurement Intelligence Engine v2.0
PROC-01467,Highways England (National Highways),Infrastructure,"Birmingham, ENG",UK,Pest Control & Sanitation Services — Highways England (National Highways),Pest Control & Sanitation,493110,"$300,000–$500,000",Parsons Corporation,3 Years + 2 Options,2026-09-09,2026-07-17,2028-04-09,2024-06-09,"Bid Form, Unit Price Schedule, Subcontractor List, DBE Compliance Plan",https://nationalhighways.co.uk/industry-information/procurement/,procurement@nationalhighways.co.uk,+44 300 123 5000,Primary: Parsons Corporation; Secondary: Regional subcontractors,Agency failed last audit — compliance consulting opportunity,Manual scheduling of recurring services — automation ROI 300%+,"$15,000/mo",HIGH — Prepare in 30 Days,2026-05-29,Prime Pathwy Procurement Intelligence Engine v2.0
PROC-01474,Crown Commercial Service (CCS),Central Government,"Liverpool, ENG",UK,Custodial Services Contract — Crown Commercial Service (CCS),Janitorial & Custodial Services,561710,"$75,000–$150,000",Leidos Holdings Inc.,Indefinite Delivery/Indefinite Quantity (IDIQ),2026-07-19,2026-07-29,2027-07-29,2025-03-15,"Online Portal Registration, Capability Statement, GSA Schedule Number",https://www.crowncommercial.gov.uk,info@crowncommercial.gov.uk,+44 345 410 2222,Primary: Leidos Holdings Inc.; Secondary: Regional subcontractors,Contract approaching renewal — 90-day window to position,Paper-based compliance tracking — digitization opportunity worth $50K+/yr,"$50,000/mo",CRITICAL — Bid Now,2026-05-29,Prime Pathwy Procurement Intelligence Engine v2.0
PROC-01475,City of Melbourne — Procurement,Municipal,"Melbourne, VIC",AU,Debris Removal & Waste Hauling Services — City of Melbourne,Debris Removal & Waste Management,561730,"$10,000,000–$25,000,000",ServiceMaster Clean,5 Years,2026-06-27,2026-11-11,2027-11-17,2024-06-21,"Bid Bond (5%), Performance Bond (100%), Payment Bond (100%), NAICS Certification",https://www.melbourne.vic.gov.au/business/tenders-and-contracts,procurement@melbourne.vic.gov.au,+61 3 9658 9658,Primary: ServiceMaster Clean; Secondary: Regional subcontractors,Contract approaching renewal — 90-day window to position,Spreadsheet-based vendor management — CRM integration opportunity,"$25,000/mo",CRITICAL — Bid Now,2026-05-29,Prime Pathwy Procurement Intelligence Engine v2.0
PROC-01478,London Borough of Southwark — Procurement,Municipal,"London, ENG",UK,Debris Removal & Waste Hauling Services — London Borough of Southwark,Debris Removal & Waste Management,238320,"$5,000,000–$10,000,000",CACI International,3 Years + 2 Options,2026-07-26,2026-08-13,2027-06-13,2025-07-27,"Bid Form, Unit Price Schedule, Subcontractor List, DBE Compliance Plan",https://www.southwark.gov.uk/business/procurement,procurement@southwark.gov.uk,+44 207 525 5000,Primary: CACI International; Secondary: Regional subcontractors,Incumbent lacks digital reporting capability — tech upgrade opportunity,Paper-based compliance tracking — digitization opportunity worth $50K+/yr,"$10,000/mo",CRITICAL — Bid Now,2026-05-29,Prime Pathwy Procurement Intelligence Engine v2.0
PROC-01479,Birmingham City Council — Procurement,Municipal,"Birmingham, ENG",UK,Fleet Maintenance & Vehicle Repair Services — Birmingham City Council,Fleet Maintenance & Vehicle Services,493110,"$75,000–$150,000",Xerox Corporation,3 Years + 2 Options,2026-08-16,2026-07-30,2027-05-20,2024-12-11,"RFP Response, ISO 9001 Certification, Environmental Compliance Documentation",https://www.birmingham.gov.uk/procurement,procurement@birmingham.gov.uk,+44 121 303 9944,Primary: Xerox Corporation; Secondary: Regional subcontractors,Incumbent pricing 30%+ above market — cost reduction opportunity,Email-based bid notifications — automated alert system opportunity,"$15,000/mo",MEDIUM — 60-Day Pipeline,2026-05-29,Prime Pathwy Procurement Intelligence Engine v2.0
PROC-01481,Public Services and Procurement Canada (PSPC),Federal,"Ottawa, ON",CA,Custodial Services Contract — Public Services and Procurement Canada (PSPC),Janitorial & Custodial Services,238320,"$500,000–$1,000,000",Sodexo USA,2 Years,2026-08-28,2026-10-27,2028-05-15,2025-03-13,"RFP Response, ISO 9001 Certification, Environmental Compliance Documentation",https://buyandsell.gc.ca,pspc.procurement@tpsgc-pwgsc.gc.ca,+1 (800) 811-1148,Primary: Sodexo USA; Secondary: Regional subcontractors,Incumbent vendor has poor performance reviews — displacement opportunity,Paper-based compliance tracking — digitization opportunity worth $50K+/yr,"$7,500/mo",HIGH — Prepare in 30 Days,2026-05-29,Prime Pathwy Procurement Intelligence Engine v2.0
PROC-01482,Queensland Government — QTenders,State,"Brisbane, QLD",AU,Uniformed Security Guard Services — Queensland Government,Security Guard Services,561730,"$2,500,000–$5,000,000",Xerox Corporation,1 Year + 4 Options,2026-07-16,2026-07-24,2026-10-13,2025-03-14,"RFP Response, Financial Statements, References (3), Insurance Certificates, Business License",https://qtenders.epw.qld.gov.au,procurement@epw.qld.gov.au,+61 7 3224 2111,Primary: Xerox Corporation; Secondary: Regional subcontractors,Incumbent lacks digital reporting capability — tech upgrade opportunity,Paper-based compliance tracking — digitization opportunity worth $50K+/yr,"$25,000/mo",CRITICAL — Bid Now,2026-05-29,Prime Pathwy Procurement Intelligence Engine v2.0
PROC-01484,AusTender — Australian Government Procurement,Federal,"Canberra, ACT",AU,AI & Process Automation Implementation Services — AusTender,AI & Automation Implementation,561720,"$150,000–$300,000",Robert Half International,5 Years,2026-09-17,2026-10-08,2026-09-20,2024-10-06,"SOQ (Statement of Qualifications), MWBE Certification, Safety Record, Insurance",https://www.tenders.gov.au,austender@finance.gov.au,+61 2 6215 2222,Primary: Robert Half International; Secondary: Regional subcontractors,Incumbent pricing 30%+ above market — cost reduction opportunity,Manual invoice processing — AI automation saves 40+ hours/month,"$10,000/mo",WATCH — 90+ Days,2026-05-29,Prime Pathwy Procurement Intelligence Engine v2.0
PROC-01486,Public Services and Procurement Canada (PSPC),Federal,"Ottawa, ON",CA,Construction & Facility Renovation Services — Public Services and Procurement Canada (PSPC),Construction & Renovation,238320,"$75,000–$150,000",Jani-King International,5 Years,2026-08-29,2026-08-04,2027-05-19,2024-08-16,"Technical Proposal, Price Schedule, Organizational Chart, Key Personnel Resumes",https://buyandsell.gc.ca,pspc.procurement@tpsgc-pwgsc.gc.ca,+1 (800) 811-1148,Primary: Jani-King International; Secondary: Regional subcontractors,Agency issued corrective action to incumbent — replacement opportunity,Manual invoice processing — AI automation saves 40+ hours/month,"$2,500/mo",WATCH — 90+ Days,2026-05-29,Prime Pathwy Procurement Intelligence Engine v2.0
PROC-01493,Ministry of Defence (MOD) — Defence Equipment & Support,Federal/Defence,"Bristol, ENG",UK,Public Works & Infrastructure Maintenance — Ministry of Defence (MOD),Public Works & Infrastructure,484110,"$500,000–$1,000,000",Regional Service Provider,5 Years,2026-06-26,2026-09-11,2028-03-03,2025-09-13,"Online Portal Registration, Capability Statement, GSA Schedule Number",https://www.gov.uk/government/organisations/defence-equipment-and-support,des-procurement@mod.gov.uk,+44 306 770 0000,Primary: Regional Service Provider; Secondary: Regional subcontractors,Agency issued corrective action to incumbent — replacement opportunity,Manual route optimization for service delivery — AI routing saves 20% fuel cost,"$10,000/mo",CRITICAL — Bid Now,2026-05-29,Prime Pathwy Procurement Intelligence Engine v2.0
PROC-01494,Crown Commercial Service (CCS),Central Government,"Liverpool, ENG",UK,Debris Removal & Waste Hauling Services — Crown Commercial Service (CCS),Debris Removal & Waste Management,561612,"$2,500,000–$5,000,000",Jacobs Engineering Group,3 Years,2026-07-24,2026-10-15,2026-12-12,2024-10-11,"RFP Response, Financial Statements, References (3), Insurance Certificates, Business License",https://www.crowncommercial.gov.uk,info@crowncommercial.gov.uk,+44 345 410 2222,Primary: Jacobs Engineering Group; Secondary: Regional subcontractors,Incumbent lacks digital reporting capability — tech upgrade opportunity,Spreadsheet-based vendor management — CRM integration opportunity,"$10,000/mo",MEDIUM — 60-Day Pipeline,2026-05-29,Prime Pathwy Procurement Intelligence Engine v2.0
PROC-01496,NSW Government — eTendering,State,"Sydney, NSW",AU,Transportation & Logistics Services — NSW Government,Transportation & Logistics,561710,"$300,000–$500,000",Manpower Group,3 Years,2026-07-09,2026-09-22,2027-06-19,2025-05-03,"RFQ Response, DUNS/SAM Registration, Bonding Proof, W-9, Past Performance",https://tenders.nsw.gov.au,procurement@treasury.nsw.gov.au,+61 2 9228 4000,Primary: Manpower Group; Secondary: Regional subcontractors,New agency director — procurement philosophy shift expected,Manual scheduling of recurring services — automation ROI 300%+,"$7,500/mo",CRITICAL — Bid Now,2026-05-29,Prime Pathwy Procurement Intelligence Engine v2.0
PROC-01499,Ministry of Defence (MOD) — Defence Equipment & Support,Federal/Defence,"Bristol, ENG",UK,Temporary Staffing & Workforce Solutions — Ministry of Defence (MOD),Staffing & Temporary Labor,484110,"$25,000–$75,000",ServiceMaster Clean,3 Years + 2 Options,2026-07-30,2026-09-24,2027-02-18,2025-11-17,"SOQ (Statement of Qualifications), MWBE Certification, Safety Record, Insurance",https://www.gov.uk/government/organisations/defence-equipment-and-support,des-procurement@mod.gov.uk,+44 306 770 0000,Primary: ServiceMaster Clean; Secondary: Regional subcontractors,Incumbent lacks digital reporting capability — tech upgrade opportunity,Paper-based compliance tracking — digitization opportunity worth $50K+/yr,"$7,500/mo",WATCH — 90+ Days,2026-05-29,Prime Pathwy Procurement Intelligence Engine v2.0
PROC-01500,Crown Commercial Service (CCS),Central Government,"Liverpool, ENG",UK,Grounds Maintenance & Landscaping Services — Crown Commercial Service (CCS),Landscaping & Grounds Maintenance,562111,"$150,000–$300,000",Allied Universal Security Services,5 Years,2026-08-10,2026-11-23,2027-04-15,2024-10-13,"Technical Proposal, Price Schedule, Organizational Chart, Key Personnel Resumes",https://www.crowncommercial.gov.uk,info@crowncommercial.gov.uk,+44 345 410 2222,Primary: Allied Universal Security Services; Secondary: Regional subcontractors,New agency director — procurement philosophy shift expected,Manual route optimization for service delivery — AI routing saves 20% fuel cost,"$7,500/mo",MEDIUM — 60-Day Pipeline,2026-05-29,Prime Pathwy Procurement Intelligence Engine v2.0
PROC-01502,City of Vancouver — Procurement Services,Municipal,"Vancouver, BC",CA,Debris Removal & Waste Hauling Services — City of Vancouver,Debris Removal & Waste Management,561730,"$75,000–$150,000",Recall Holdings,1 Year + 4 Options,2026-07-03,2026-10-27,2027-11-02,2024-12-25,"RFP Response, ISO 9001 Certification, Environmental Compliance Documentation",https://vancouver.ca/doing-business/procurement.aspx,procurement@vancouver.ca,+1 (604) 873-7000,Primary: Recall Holdings; Secondary: Regional subcontractors,Incumbent vendor has poor performance reviews — displacement opportunity,Manual contract renewal tracking — automated renewal system opportunity,"$7,500/mo",WATCH — 90+ Days,2026-05-29,Prime Pathwy Procurement Intelligence Engine v2.0
PROC-01503,Toronto Transit Commission (TTC) — Procurement,Transit,"Toronto, ON",CA,Debris Removal & Waste Hauling Services — Toronto Transit Commission (TTC),Debris Removal & Waste Management,493110,"$25,000–$75,000",CACI International,1 Year,2026-07-17,2026-09-22,2027-08-15,2025-02-23,"RFP Response, ISO 9001 Certification, Environmental Compliance Documentation",https://www.ttc.ca/doing-business-with-ttc,procurement@ttc.ca,+1 (416) 393-4000,Primary: CACI International; Secondary: Regional subcontractors,Agency has budget surplus in Q4 — accelerated procurement window,Manual contract renewal tracking — automated renewal system opportunity,"$15,000/mo",CRITICAL — Bid Now,2026-05-29,Prime Pathwy Procurement Intelligence Engine v2.0
PROC-01506,Highways England (National Highways),Infrastructure,"Birmingham, ENG",UK,HVAC Maintenance & Mechanical Services — Highways England (National Highways),HVAC & Mechanical Services,561612,"$25,000,000+",Aramark Corporation,Indefinite Delivery/Indefinite Quantity (IDIQ),2026-07-31,2026-09-01,2026-11-18,2025-11-13,"RFQ Response, DUNS/SAM Registration, Bonding Proof, W-9, Past Performance",https://nationalhighways.co.uk/industry-information/procurement/,procurement@nationalhighways.co.uk,+44 300 123 5000,Primary: Aramark Corporation; Secondary: Regional subcontractors,Incumbent pricing 30%+ above market — cost reduction opportunity,Manual invoice processing — AI automation saves 40+ hours/month,"$2,500/mo",HIGH — Prepare in 30 Days,2026-05-29,Prime Pathwy Procurement Intelligence Engine v2.0
PROC-01508,City of Melbourne — Procurement,Municipal,"Melbourne, VIC",AU,Healthcare Facility Support Services — City of Melbourne,Healthcare Support Services,493110,"$10,000,000–$25,000,000",Manpower Group,1 Year + 4 Options,2026-06-20,2026-08-08,2026-09-07,2026-02-16,"Bid Bond (5%), Performance Bond (100%), Payment Bond (100%), NAICS Certification",https://www.melbourne.vic.gov.au/business/tenders-and-contracts,procurement@melbourne.vic.gov.au,+61 3 9658 9658,Primary: Manpower Group; Secondary: Regional subcontractors,Incumbent pricing 30%+ above market — cost reduction opportunity,Manual contract renewal tracking — automated renewal system opportunity,"$15,000/mo",CRITICAL — Bid Now,2026-05-29,Prime Pathwy Procurement Intelligence Engine v2.0
PROC-01509,City of Melbourne — Procurement,Municipal,"Melbourne, VIC",AU,Facilities Maintenance & Repair Services — City of Melbourne,Facilities Maintenance & Repair,561710,"$1,000,000–$2,500,000",ServiceMaster Clean,5 Years + 2 Options,2026-08-17,2026-09-20,2027-12-22,2024-06-16,"RFQ Response, DUNS/SAM Registration, Bonding Proof, W-9, Past Performance",https://www.melbourne.vic.gov.au/business/tenders-and-contracts,procurement@melbourne.vic.gov.au,+61 3 9658 9658,Primary: ServiceMaster Clean; Secondary: Regional subcontractors,Contract approaching renewal — 90-day window to position,Manual scheduling of recurring services — automation ROI 300%+,"$25,000/mo",HIGH — Prepare in 30 Days,2026-05-29,Prime Pathwy Procurement Intelligence Engine v2.0
PROC-01513,Province of British Columbia — BC Bid,Provincial,"Victoria, BC",CA,Public Works & Infrastructure Maintenance — Province of British Columbia,Public Works & Infrastructure,561710,"$1,000,000–$2,500,000",SAIC (Science Applications International Corp.),Indefinite Delivery/Indefinite Quantity (IDIQ),2026-08-04,2026-10-13,2027-07-01,2026-02-20,"Online Portal Registration, Capability Statement, GSA Schedule Number",https://www.bcbid.gov.bc.ca,bcbid@gov.bc.ca,+1 (250) 387-7000,Primary: SAIC (Science Applications International Corp.); Secondary: Regional subcontractors,Incumbent contract expires with no renewal option — open competition,Manual scheduling of recurring services — automation ROI 300%+,"$7,500/mo",MEDIUM — 60-Day Pipeline,2026-05-29,Prime Pathwy Procurement Intelligence Engine v2.0
PROC-01518,Public Services and Procurement Canada (PSPC),Federal,"Ottawa, ON",CA,AI & Process Automation Implementation Services — Public Services and Procurement Canada (PSPC),AI & Automation Implementation,561710,"$500,000–$1,000,000",SAIC (Science Applications International Corp.),2 Years,2026-09-12,2026-09-18,2026-12-30,2024-11-19,"Bid Bond (5%), Performance Bond (100%), Payment Bond (100%), NAICS Certification",https://buyandsell.gc.ca,pspc.procurement@tpsgc-pwgsc.gc.ca,+1 (800) 811-1148,Primary: SAIC (Science Applications International Corp.); Secondary: Regional subcontractors,Agency has budget surplus in Q4 — accelerated procurement window,Spreadsheet-based vendor management — CRM integration opportunity,"$10,000/mo",HIGH — Prepare in 30 Days,2026-05-29,Prime Pathwy Procurement Intelligence Engine v2.0
PROC-01519,Birmingham City Council — Procurement,Municipal,"Birmingham, ENG",UK,Healthcare Facility Support Services — Birmingham City Council,Healthcare Support Services,562111,"$300,000–$500,000",Manpower Group,2 Years,2026-06-27,2026-09-08,2027-11-23,2025-04-23,"RFQ Response, DUNS/SAM Registration, Bonding Proof, W-9, Past Performance",https://www.birmingham.gov.uk/procurement,procurement@birmingham.gov.uk,+44 121 303 9944,Primary: Manpower Group; Secondary: Regional subcontractors,Agency failed last audit — compliance consulting opportunity,Manual invoice processing — AI automation saves 40+ hours/month,"$5,000/mo",MEDIUM — 60-Day Pipeline,2026-05-29,Prime Pathwy Procurement Intelligence Engine v2.0
PROC-01520,Highways England (National Highways),Infrastructure,"Birmingham, ENG",UK,Pest Control & Sanitation Services — Highways England (National Highways),Pest Control & Sanitation,561730,"$1,000,000–$2,500,000",Jan-Pro Franchising International,1 Year,2026-07-08,2026-09-18,2027-04-13,2025-04-11,"SOQ (Statement of Qualifications), MWBE Certification, Safety Record, Insurance",https://nationalhighways.co.uk/industry-information/procurement/,procurement@nationalhighways.co.uk,+44 300 123 5000,Primary: Jan-Pro Franchising International; Secondary: Regional subcontractors,Incumbent contract expires with no renewal option — open competition,Manual contract renewal tracking — automated renewal system opportunity,"$50,000/mo",CRITICAL — Bid Now,2026-05-29,Prime Pathwy Procurement Intelligence Engine v2.0
PROC-01521,City of Calgary — Purchasing,Municipal,"Calgary, AB",CA,Transportation & Logistics Services — City of Calgary,Transportation & Logistics,561730,"$75,000–$150,000",Jani-King International,3 Years + 2 Options,2026-07-29,2026-08-15,2027-10-23,2025-07-14,"Bid Form, Unit Price Schedule, Subcontractor List, DBE Compliance Plan",https://www.calgary.ca/business-economy/purchasing.html,purchasing@calgary.ca,+1 (403) 268-5311,Primary: Jani-King International; Secondary: Regional subcontractors,Agency has budget surplus in Q4 — accelerated procurement window,Email-based bid notifications — automated alert system opportunity,"$15,000/mo",HIGH — Prepare in 30 Days,2026-05-29,Prime Pathwy Procurement Intelligence Engine v2.0
PROC-01523,Public Services and Procurement Canada (PSPC),Federal,"Ottawa, ON",CA,Custodial Services Contract — Public Services and Procurement Canada (PSPC),Janitorial & Custodial Services,561720,"$2,500,000–$5,000,000",ManTech International,3 Years + 2 Options,2026-09-02,2026-11-02,2027-07-10,2025-03-12,"RFP Response, Financial Statements, References (3), Insurance Certificates, Business License",https://buyandsell.gc.ca,pspc.procurement@tpsgc-pwgsc.gc.ca,+1 (800) 811-1148,Primary: ManTech International; Secondary: Regional subcontractors,Incumbent vendor has poor performance reviews — displacement opportunity,Manual route optimization for service delivery — AI routing saves 20% fuel cost,"$5,000/mo",CRITICAL — Bid Now,2026-05-29,Prime Pathwy Procurement Intelligence Engine v2.0
PROC-01526,NHS Supply Chain,Healthcare,"Alfreton, ENG",UK,Healthcare Facility Support Services — NHS Supply Chain,Healthcare Support Services,541512,"$10,000,000–$25,000,000",Xerox Corporation,5 Years + 2 Options,2026-06-25,2026-07-28,2027-12-21,2024-09-10,"RFQ Response, DUNS/SAM Registration, Bonding Proof, W-9, Past Performance",https://www.nhssupplychain.nhs.uk,enquiries@nhssupplychain.nhs.uk,+44 345 600 8600,Primary: Xerox Corporation; Secondary: Regional subcontractors,Agency has documented compliance failures — audit-readiness opportunity,Manual scheduling of recurring services — automation ROI 300%+,"$5,000/mo",CRITICAL — Bid Now,2026-05-29,Prime Pathwy Procurement Intelligence Engine v2.0
PROC-01527,City of Toronto — Purchasing and Materials Management,Municipal,"Toronto, ON",CA,Professional Consulting Services — City of Toronto,Consulting & Professional Services,493110,"$10,000,000–$25,000,000",Sodexo USA,5 Years,2026-08-12,2026-10-17,2027-11-29,2024-08-01,"RFP Response, Financial Statements, References (3), Insurance Certificates, Business License",https://www.toronto.ca/business-economy/doing-business-with-the-city/purchasing-and-materials-management/,purchasing@toronto.ca,+1 (416) 392-7312,Primary: Sodexo USA; Secondary: Regional subcontractors,Agency has budget surplus in Q4 — accelerated procurement window,Manual route optimization for service delivery — AI routing saves 20% fuel cost,"$25,000/mo",HIGH — Prepare in 30 Days,2026-05-29,Prime Pathwy Procurement Intelligence Engine v2.0
PROC-01529,Toronto Transit Commission (TTC) — Procurement,Transit,"Toronto, ON",CA,Custodial Services Contract — Toronto Transit Commission (TTC),Janitorial & Custodial Services,493110,"$10,000,000–$25,000,000",CACI International,1 Year,2026-09-15,2026-08-03,2027-09-20,2025-06-11,"Technical Proposal, Price Schedule, Organizational Chart, Key Personnel Resumes",https://www.ttc.ca/doing-business-with-ttc,procurement@ttc.ca,+1 (416) 393-4000,Primary: CACI International; Secondary: Regional subcontractors,Agency issued corrective action to incumbent — replacement opportunity,Manual route optimization for service delivery — AI routing saves 20% fuel cost,"$7,500/mo",CRITICAL — Bid Now,2026-05-29,Prime Pathwy Procurement Intelligence Engine v2.0
PROC-01531,City of Sydney — Procurement,Municipal,"Sydney, NSW",AU,Temporary Staffing & Workforce Solutions — City of Sydney,Staffing & Temporary Labor,561710,"$75,000–$150,000",ManTech International,5 Years + 2 Options,2026-07-13,2026-07-20,2027-12-14,2025-04-07,"Technical Proposal, Price Schedule, Organizational Chart, Key Personnel Resumes",https://www.cityofsydney.nsw.gov.au/council/doing-business-with-us,procurement@cityofsydney.nsw.gov.au,+61 2 9265 9333,Primary: ManTech International; Secondary: Regional subcontractors,Incumbent contract expires with no renewal option — open competition,Email-based bid notifications — automated alert system opportunity,"$7,500/mo",WATCH — 90+ Days,2026-05-29,Prime Pathwy Procurement Intelligence Engine v2.0
