procurement_id,issuing_agency,agency_type,agency_location,country,contract_title,contract_category,naics_code,estimated_contract_value,incumbent_vendor,contract_duration,bid_open_date,bid_close_date,renewal_date,last_award_date,submission_requirements,procurement_portal,contact_email,contact_phone,vendor_dependencies,operational_weakness,automation_opportunity,recurring_revenue_potential,prime_pathwy_priority,data_date,source
PROC-02249,Victorian Government — Tenders VIC,State,"Melbourne, VIC",AU,Professional Consulting Services — Victorian Government,Consulting & Professional Services,562111,"$25,000–$75,000",Booz Allen Hamilton,1 Year,2026-08-30,2026-08-30,2027-12-18,2025-10-04,"Technical Proposal, Price Schedule, Organizational Chart, Key Personnel Resumes",https://www.tenders.vic.gov.au,procurement@dtf.vic.gov.au,+61 3 9651 5111,Primary: Booz Allen Hamilton; Secondary: Regional subcontractors,Agency issued corrective action to incumbent — replacement opportunity,Spreadsheet-based vendor management — CRM integration opportunity,"$25,000/mo",HIGH — Prepare in 30 Days,2026-05-29,Prime Pathwy Procurement Intelligence Engine v2.0
PROC-02255,Toronto Transit Commission (TTC) — Procurement,Transit,"Toronto, ON",CA,Temporary Staffing & Workforce Solutions — Toronto Transit Commission (TTC),Staffing & Temporary Labor,541512,"$2,500,000–$5,000,000",Adecco Group,3 Years,2026-09-10,2026-09-02,2028-03-26,2024-12-07,"Online Portal Registration, Capability Statement, GSA Schedule Number",https://www.ttc.ca/doing-business-with-ttc,procurement@ttc.ca,+1 (416) 393-4000,Primary: Adecco Group; Secondary: Regional subcontractors,Incumbent vendor has poor performance reviews — displacement opportunity,Manual invoice processing — AI automation saves 40+ hours/month,"$2,500/mo",CRITICAL — Bid Now,2026-05-29,Prime Pathwy Procurement Intelligence Engine v2.0
PROC-02258,NHS Supply Chain,Healthcare,"Alfreton, ENG",UK,IT Infrastructure & Managed Services Contract — NHS Supply Chain,IT Infrastructure & Managed Services,561612,"$25,000–$75,000",Booz Allen Hamilton,3 Years,2026-07-11,2026-07-18,2028-05-02,2025-05-18,"Bid Bond (5%), Performance Bond (100%), Payment Bond (100%), NAICS Certification",https://www.nhssupplychain.nhs.uk,enquiries@nhssupplychain.nhs.uk,+44 345 600 8600,Primary: Booz Allen Hamilton; Secondary: Regional subcontractors,Incumbent pricing 30%+ above market — cost reduction opportunity,Manual scheduling of recurring services — automation ROI 300%+,"$2,500/mo",WATCH — 90+ Days,2026-05-29,Prime Pathwy Procurement Intelligence Engine v2.0
PROC-02260,NHS Supply Chain,Healthcare,"Alfreton, ENG",UK,Food Services & Catering Contract — NHS Supply Chain,Food Services & Catering,541512,"$150,000–$300,000",Jan-Pro Franchising International,3 Years,2026-06-27,2026-10-01,2027-07-13,2024-12-17,"RFQ Response, DUNS/SAM Registration, Bonding Proof, W-9, Past Performance",https://www.nhssupplychain.nhs.uk,enquiries@nhssupplychain.nhs.uk,+44 345 600 8600,Primary: Jan-Pro Franchising International; Secondary: Regional subcontractors,Incumbent contract expires with no renewal option — open competition,Manual route optimization for service delivery — AI routing saves 20% fuel cost,"$10,000/mo",HIGH — Prepare in 30 Days,2026-05-29,Prime Pathwy Procurement Intelligence Engine v2.0
PROC-02263,Public Services and Procurement Canada (PSPC),Federal,"Ottawa, ON",CA,Public Works & Infrastructure Maintenance — Public Services and Procurement Canada (PSPC),Public Works & Infrastructure,561720,"$300,000–$500,000",Coverall Holding Company,5 Years,2026-07-07,2026-09-12,2027-07-27,2025-12-03,"Online Portal Registration, Capability Statement, GSA Schedule Number",https://buyandsell.gc.ca,pspc.procurement@tpsgc-pwgsc.gc.ca,+1 (800) 811-1148,Primary: Coverall Holding Company; Secondary: Regional subcontractors,Incumbent vendor has poor performance reviews — displacement opportunity,Manual contract renewal tracking — automated renewal system opportunity,"$50,000/mo",HIGH — Prepare in 30 Days,2026-05-29,Prime Pathwy Procurement Intelligence Engine v2.0
PROC-02264,Victorian Government — Tenders VIC,State,"Melbourne, VIC",AU,Uniformed Security Guard Services — Victorian Government,Security Guard Services,541512,"$1,000,000–$2,500,000",Republic Services Inc.,2 Years,2026-08-22,2026-11-24,2027-06-13,2025-06-23,"Bid Form, Unit Price Schedule, Subcontractor List, DBE Compliance Plan",https://www.tenders.vic.gov.au,procurement@dtf.vic.gov.au,+61 3 9651 5111,Primary: Republic Services Inc.; Secondary: Regional subcontractors,Incumbent vendor has poor performance reviews — displacement opportunity,Manual scheduling of recurring services — automation ROI 300%+,"$5,000/mo",WATCH — 90+ Days,2026-05-29,Prime Pathwy Procurement Intelligence Engine v2.0
PROC-02266,Crown Commercial Service (CCS),Central Government,"Liverpool, ENG",UK,Fleet Maintenance & Vehicle Repair Services — Crown Commercial Service (CCS),Fleet Maintenance & Vehicle Services,561710,"$75,000–$150,000",Republic Services Inc.,5 Years + 2 Options,2026-09-22,2026-08-28,2027-07-13,2025-03-24,"RFP Response, ISO 9001 Certification, Environmental Compliance Documentation",https://www.crowncommercial.gov.uk,info@crowncommercial.gov.uk,+44 345 410 2222,Primary: Republic Services Inc.; Secondary: Regional subcontractors,Incumbent lacks digital reporting capability — tech upgrade opportunity,Manual route optimization for service delivery — AI routing saves 20% fuel cost,"$25,000/mo",MEDIUM — 60-Day Pipeline,2026-05-29,Prime Pathwy Procurement Intelligence Engine v2.0
PROC-02267,Public Services and Procurement Canada (PSPC),Federal,"Ottawa, ON",CA,HVAC Maintenance & Mechanical Services — Public Services and Procurement Canada (PSPC),HVAC & Mechanical Services,541512,"$75,000–$150,000",Jani-King International,1 Year + 4 Options,2026-07-25,2026-11-10,2026-11-03,2024-12-05,"RFP Response, Financial Statements, References (3), Insurance Certificates, Business License",https://buyandsell.gc.ca,pspc.procurement@tpsgc-pwgsc.gc.ca,+1 (800) 811-1148,Primary: Jani-King International; Secondary: Regional subcontractors,New agency director — procurement philosophy shift expected,Manual route optimization for service delivery — AI routing saves 20% fuel cost,"$15,000/mo",WATCH — 90+ Days,2026-05-29,Prime Pathwy Procurement Intelligence Engine v2.0
PROC-02268,NSW Government — eTendering,State,"Sydney, NSW",AU,Custodial Services Contract — NSW Government,Janitorial & Custodial Services,541513,"$10,000,000–$25,000,000",Jan-Pro Franchising International,5 Years,2026-09-06,2026-09-22,2028-05-28,2026-05-11,"SOQ (Statement of Qualifications), MWBE Certification, Safety Record, Insurance",https://tenders.nsw.gov.au,procurement@treasury.nsw.gov.au,+61 2 9228 4000,Primary: Jan-Pro Franchising International; Secondary: Regional subcontractors,Agency has documented compliance failures — audit-readiness opportunity,Paper-based compliance tracking — digitization opportunity worth $50K+/yr,"$10,000/mo",MEDIUM — 60-Day Pipeline,2026-05-29,Prime Pathwy Procurement Intelligence Engine v2.0
PROC-02269,AusTender — Australian Government Procurement,Federal,"Canberra, ACT",AU,Food Services & Catering Contract — AusTender,Food Services & Catering,541512,"$300,000–$500,000",Waste Management Inc.,1 Year + 4 Options,2026-06-25,2026-07-19,2027-08-02,2024-07-27,"RFP Response, ISO 9001 Certification, Environmental Compliance Documentation",https://www.tenders.gov.au,austender@finance.gov.au,+61 2 6215 2222,Primary: Waste Management Inc.; Secondary: Regional subcontractors,Incumbent contract expires with no renewal option — open competition,Manual route optimization for service delivery — AI routing saves 20% fuel cost,"$2,500/mo",MEDIUM — 60-Day Pipeline,2026-05-29,Prime Pathwy Procurement Intelligence Engine v2.0
PROC-02270,Public Services and Procurement Canada (PSPC),Federal,"Ottawa, ON",CA,Environmental Compliance & Remediation Services — Public Services and Procurement Canada (PSPC),Environmental Compliance Services,238320,"$500,000–$1,000,000",Recall Holdings,Indefinite Delivery/Indefinite Quantity (IDIQ),2026-09-26,2026-09-13,2028-05-27,2025-03-05,"RFP Response, ISO 9001 Certification, Environmental Compliance Documentation",https://buyandsell.gc.ca,pspc.procurement@tpsgc-pwgsc.gc.ca,+1 (800) 811-1148,Primary: Recall Holdings; Secondary: Regional subcontractors,Incumbent pricing 30%+ above market — cost reduction opportunity,Manual contract renewal tracking — automated renewal system opportunity,"$2,500/mo",HIGH — Prepare in 30 Days,2026-05-29,Prime Pathwy Procurement Intelligence Engine v2.0
PROC-02272,Crown Commercial Service (CCS),Central Government,"Liverpool, ENG",UK,Facilities Maintenance & Repair Services — Crown Commercial Service (CCS),Facilities Maintenance & Repair,484110,"$2,500,000–$5,000,000",Manpower Group,5 Years + 2 Options,2026-07-01,2026-11-07,2027-12-29,2024-06-10,"RFP Response, ISO 9001 Certification, Environmental Compliance Documentation",https://www.crowncommercial.gov.uk,info@crowncommercial.gov.uk,+44 345 410 2222,Primary: Manpower Group; Secondary: Regional subcontractors,Incumbent vendor has poor performance reviews — displacement opportunity,Paper timesheets — digital workforce management opportunity,"$5,000/mo",MEDIUM — 60-Day Pipeline,2026-05-29,Prime Pathwy Procurement Intelligence Engine v2.0
PROC-02273,Transport for NSW,Transit/Infrastructure,"Sydney, NSW",AU,Healthcare Facility Support Services — Transport for NSW,Healthcare Support Services,562111,"$10,000,000–$25,000,000",Robert Half International,5 Years + 2 Options,2026-06-13,2026-11-08,2027-01-07,2025-06-19,"RFP Response, Financial Statements, References (3), Insurance Certificates, Business License",https://www.transport.nsw.gov.au/industry-and-business/procurement,procurement@transport.nsw.gov.au,+61 2 8202 2200,Primary: Robert Half International; Secondary: Regional subcontractors,Agency issued corrective action to incumbent — replacement opportunity,Manual route optimization for service delivery — AI routing saves 20% fuel cost,"$5,000/mo",WATCH — 90+ Days,2026-05-29,Prime Pathwy Procurement Intelligence Engine v2.0
PROC-02277,City of Vancouver — Procurement Services,Municipal,"Vancouver, BC",CA,IT Infrastructure & Managed Services Contract — City of Vancouver,IT Infrastructure & Managed Services,561612,"$10,000,000–$25,000,000",Regional Service Provider,5 Years + 2 Options,2026-08-21,2026-10-27,2027-10-10,2024-09-02,"SOQ (Statement of Qualifications), MWBE Certification, Safety Record, Insurance",https://vancouver.ca/doing-business/procurement.aspx,procurement@vancouver.ca,+1 (604) 873-7000,Primary: Regional Service Provider; Secondary: Regional subcontractors,Incumbent contract expires with no renewal option — open competition,Manual route optimization for service delivery — AI routing saves 20% fuel cost,"$25,000/mo",MEDIUM — 60-Day Pipeline,2026-05-29,Prime Pathwy Procurement Intelligence Engine v2.0
PROC-02280,Province of Ontario — Ontario Shared Services,Provincial,"Toronto, ON",CA,Facilities Maintenance & Repair Services — Province of Ontario,Facilities Maintenance & Repair,541513,"$25,000–$75,000",Jani-King International,2 Years,2026-07-15,2026-08-10,2027-10-14,2024-12-20,"Bid Form, Unit Price Schedule, Subcontractor List, DBE Compliance Plan",https://www.ontario.ca/page/doing-business-government,oss.procurement@ontario.ca,+1 (416) 326-1234,Primary: Jani-King International; Secondary: Regional subcontractors,Incumbent lacks digital reporting capability — tech upgrade opportunity,Paper-based compliance tracking — digitization opportunity worth $50K+/yr,"$2,500/mo",WATCH — 90+ Days,2026-05-29,Prime Pathwy Procurement Intelligence Engine v2.0
PROC-02281,City of Melbourne — Procurement,Municipal,"Melbourne, VIC",AU,Food Services & Catering Contract — City of Melbourne,Food Services & Catering,541513,"$5,000,000–$10,000,000",Stericycle Inc.,5 Years + 2 Options,2026-07-28,2026-08-29,2027-01-26,2025-10-18,"Bid Bond (5%), Performance Bond (100%), Payment Bond (100%), NAICS Certification",https://www.melbourne.vic.gov.au/business/tenders-and-contracts,procurement@melbourne.vic.gov.au,+61 3 9658 9658,Primary: Stericycle Inc.; Secondary: Regional subcontractors,Agency issued corrective action to incumbent — replacement opportunity,Manual invoice processing — AI automation saves 40+ hours/month,"$10,000/mo",CRITICAL — Bid Now,2026-05-29,Prime Pathwy Procurement Intelligence Engine v2.0
PROC-02282,NSW Government — eTendering,State,"Sydney, NSW",AU,Facilities Maintenance & Repair Services — NSW Government,Facilities Maintenance & Repair,541513,"$2,500,000–$5,000,000",Robert Half International,Indefinite Delivery/Indefinite Quantity (IDIQ),2026-09-23,2026-08-26,2028-04-11,2025-11-28,"RFP Response, ISO 9001 Certification, Environmental Compliance Documentation",https://tenders.nsw.gov.au,procurement@treasury.nsw.gov.au,+61 2 9228 4000,Primary: Robert Half International; Secondary: Regional subcontractors,Incumbent pricing 30%+ above market — cost reduction opportunity,Manual route optimization for service delivery — AI routing saves 20% fuel cost,"$15,000/mo",CRITICAL — Bid Now,2026-05-29,Prime Pathwy Procurement Intelligence Engine v2.0
PROC-02284,Transport for London (TfL) — Procurement,Transit,"London, ENG",UK,Debris Removal & Waste Hauling Services — Transport for London (TfL),Debris Removal & Waste Management,561710,"$500,000–$1,000,000",Clean Harbors Inc.,5 Years,2026-09-06,2026-07-17,2027-09-28,2024-06-09,"RFP Response, ISO 9001 Certification, Environmental Compliance Documentation",https://tfl.gov.uk/info-for/suppliers/,procurement@tfl.gov.uk,+44 343 222 1234,Primary: Clean Harbors Inc.; Secondary: Regional subcontractors,New agency director — procurement philosophy shift expected,Paper-based compliance tracking — digitization opportunity worth $50K+/yr,"$15,000/mo",WATCH — 90+ Days,2026-05-29,Prime Pathwy Procurement Intelligence Engine v2.0
PROC-02285,City of Sydney — Procurement,Municipal,"Sydney, NSW",AU,Temporary Staffing & Workforce Solutions — City of Sydney,Staffing & Temporary Labor,561612,"$25,000–$75,000",Clean Harbors Inc.,1 Year,2026-08-21,2026-09-04,2027-04-29,2024-12-23,"Online Portal Registration, Capability Statement, GSA Schedule Number",https://www.cityofsydney.nsw.gov.au/council/doing-business-with-us,procurement@cityofsydney.nsw.gov.au,+61 2 9265 9333,Primary: Clean Harbors Inc.; Secondary: Regional subcontractors,Incumbent vendor has poor performance reviews — displacement opportunity,Manual route optimization for service delivery — AI routing saves 20% fuel cost,"$25,000/mo",MEDIUM — 60-Day Pipeline,2026-05-29,Prime Pathwy Procurement Intelligence Engine v2.0
PROC-02286,Toronto Transit Commission (TTC) — Procurement,Transit,"Toronto, ON",CA,HVAC Maintenance & Mechanical Services — Toronto Transit Commission (TTC),HVAC & Mechanical Services,561612,"$150,000–$300,000",Allied Universal Security Services,3 Years + 2 Options,2026-07-22,2026-09-13,2028-01-08,2026-01-11,"Bid Bond (5%), Performance Bond (100%), Payment Bond (100%), NAICS Certification",https://www.ttc.ca/doing-business-with-ttc,procurement@ttc.ca,+1 (416) 393-4000,Primary: Allied Universal Security Services; Secondary: Regional subcontractors,Contract approaching renewal — 90-day window to position,Manual scheduling of recurring services — automation ROI 300%+,"$50,000/mo",MEDIUM — 60-Day Pipeline,2026-05-29,Prime Pathwy Procurement Intelligence Engine v2.0
PROC-02287,City of Sydney — Procurement,Municipal,"Sydney, NSW",AU,Pest Control & Sanitation Services — City of Sydney,Pest Control & Sanitation,541512,"$2,500,000–$5,000,000",Parsons Corporation,2 Years,2026-08-14,2026-08-27,2028-05-22,2025-12-30,"RFP Response, ISO 9001 Certification, Environmental Compliance Documentation",https://www.cityofsydney.nsw.gov.au/council/doing-business-with-us,procurement@cityofsydney.nsw.gov.au,+61 2 9265 9333,Primary: Parsons Corporation; Secondary: Regional subcontractors,Incumbent lacks digital reporting capability — tech upgrade opportunity,Manual contract renewal tracking — automated renewal system opportunity,"$5,000/mo",CRITICAL — Bid Now,2026-05-29,Prime Pathwy Procurement Intelligence Engine v2.0
PROC-02288,City of Toronto — Purchasing and Materials Management,Municipal,"Toronto, ON",CA,Construction & Facility Renovation Services — City of Toronto,Construction & Renovation,561720,"$500,000–$1,000,000",Clean Harbors Inc.,5 Years,2026-08-21,2026-09-12,2027-03-02,2025-04-13,"Bid Form, Unit Price Schedule, Subcontractor List, DBE Compliance Plan",https://www.toronto.ca/business-economy/doing-business-with-the-city/purchasing-and-materials-management/,purchasing@toronto.ca,+1 (416) 392-7312,Primary: Clean Harbors Inc.; Secondary: Regional subcontractors,Agency failed last audit — compliance consulting opportunity,Paper-based compliance tracking — digitization opportunity worth $50K+/yr,"$7,500/mo",MEDIUM — 60-Day Pipeline,2026-05-29,Prime Pathwy Procurement Intelligence Engine v2.0
PROC-02292,NSW Government — eTendering,State,"Sydney, NSW",AU,AI & Process Automation Implementation Services — NSW Government,AI & Automation Implementation,541512,"$2,500,000–$5,000,000",ManTech International,5 Years + 2 Options,2026-07-27,2026-09-05,2027-06-26,2025-07-22,"RFP Response, ISO 9001 Certification, Environmental Compliance Documentation",https://tenders.nsw.gov.au,procurement@treasury.nsw.gov.au,+61 2 9228 4000,Primary: ManTech International; Secondary: Regional subcontractors,Contract approaching renewal — 90-day window to position,Manual invoice processing — AI automation saves 40+ hours/month,"$5,000/mo",CRITICAL — Bid Now,2026-05-29,Prime Pathwy Procurement Intelligence Engine v2.0
PROC-02297,City of Vancouver — Procurement Services,Municipal,"Vancouver, BC",CA,Healthcare Facility Support Services — City of Vancouver,Healthcare Support Services,484110,"$5,000,000–$10,000,000",Leidos Holdings Inc.,5 Years,2026-07-15,2026-09-04,2028-02-26,2025-09-02,"RFP Response, Financial Statements, References (3), Insurance Certificates, Business License",https://vancouver.ca/doing-business/procurement.aspx,procurement@vancouver.ca,+1 (604) 873-7000,Primary: Leidos Holdings Inc.; Secondary: Regional subcontractors,Incumbent pricing 30%+ above market — cost reduction opportunity,Paper timesheets — digital workforce management opportunity,"$25,000/mo",CRITICAL — Bid Now,2026-05-29,Prime Pathwy Procurement Intelligence Engine v2.0
PROC-02298,AusTender — Australian Government Procurement,Federal,"Canberra, ACT",AU,Electrical Maintenance & Repair Services — AusTender,Electrical Services,561730,"$1,000,000–$2,500,000",Local Independent Vendor,1 Year,2026-09-15,2026-09-23,2027-12-16,2026-03-16,"Bid Form, Unit Price Schedule, Subcontractor List, DBE Compliance Plan",https://www.tenders.gov.au,austender@finance.gov.au,+61 2 6215 2222,Primary: Local Independent Vendor; Secondary: Regional subcontractors,Incumbent lacks digital reporting capability — tech upgrade opportunity,Manual contract renewal tracking — automated renewal system opportunity,"$10,000/mo",WATCH — 90+ Days,2026-05-29,Prime Pathwy Procurement Intelligence Engine v2.0
PROC-02302,Province of Ontario — Ontario Shared Services,Provincial,"Toronto, ON",CA,Construction & Facility Renovation Services — Province of Ontario,Construction & Renovation,562111,"$10,000,000–$25,000,000",Jacobs Engineering Group,5 Years,2026-08-17,2026-10-02,2027-05-27,2025-12-07,"Technical Proposal, Price Schedule, Organizational Chart, Key Personnel Resumes",https://www.ontario.ca/page/doing-business-government,oss.procurement@ontario.ca,+1 (416) 326-1234,Primary: Jacobs Engineering Group; Secondary: Regional subcontractors,Incumbent lacks digital reporting capability — tech upgrade opportunity,Paper timesheets — digital workforce management opportunity,"$7,500/mo",MEDIUM — 60-Day Pipeline,2026-05-29,Prime Pathwy Procurement Intelligence Engine v2.0
PROC-02304,NSW Government — eTendering,State,"Sydney, NSW",AU,Uniformed Security Guard Services — NSW Government,Security Guard Services,561720,"$2,500,000–$5,000,000",Waste Management Inc.,3 Years,2026-07-12,2026-10-21,2027-03-08,2025-02-15,"Bid Bond (5%), Performance Bond (100%), Payment Bond (100%), NAICS Certification",https://tenders.nsw.gov.au,procurement@treasury.nsw.gov.au,+61 2 9228 4000,Primary: Waste Management Inc.; Secondary: Regional subcontractors,Agency issued corrective action to incumbent — replacement opportunity,Spreadsheet-based vendor management — CRM integration opportunity,"$10,000/mo",WATCH — 90+ Days,2026-05-29,Prime Pathwy Procurement Intelligence Engine v2.0
PROC-02306,NSW Government — eTendering,State,"Sydney, NSW",AU,Records Management & Document Digitization Services — NSW Government,Records Management & Digitization,561612,"$25,000–$75,000",Republic Services Inc.,1 Year + 4 Options,2026-09-10,2026-10-17,2028-01-11,2025-01-29,"RFQ Response, DUNS/SAM Registration, Bonding Proof, W-9, Past Performance",https://tenders.nsw.gov.au,procurement@treasury.nsw.gov.au,+61 2 9228 4000,Primary: Republic Services Inc.; Secondary: Regional subcontractors,Agency issued corrective action to incumbent — replacement opportunity,Email-based bid notifications — automated alert system opportunity,"$5,000/mo",CRITICAL — Bid Now,2026-05-29,Prime Pathwy Procurement Intelligence Engine v2.0
PROC-02308,Transport for London (TfL) — Procurement,Transit,"London, ENG",UK,Facilities Maintenance & Repair Services — Transport for London (TfL),Facilities Maintenance & Repair,493110,"$2,500,000–$5,000,000",Sodexo USA,1 Year,2026-07-16,2026-07-13,2027-01-22,2024-07-20,"Bid Form, Unit Price Schedule, Subcontractor List, DBE Compliance Plan",https://tfl.gov.uk/info-for/suppliers/,procurement@tfl.gov.uk,+44 343 222 1234,Primary: Sodexo USA; Secondary: Regional subcontractors,Incumbent pricing 30%+ above market — cost reduction opportunity,Paper-based compliance tracking — digitization opportunity worth $50K+/yr,"$50,000/mo",HIGH — Prepare in 30 Days,2026-05-29,Prime Pathwy Procurement Intelligence Engine v2.0
PROC-02310,Crown Commercial Service (CCS),Central Government,"Liverpool, ENG",UK,Environmental Compliance & Remediation Services — Crown Commercial Service (CCS),Environmental Compliance Services,541512,"$75,000–$150,000",Stericycle Inc.,2 Years,2026-09-03,2026-07-23,2027-07-31,2026-02-02,"RFP Response, Financial Statements, References (3), Insurance Certificates, Business License",https://www.crowncommercial.gov.uk,info@crowncommercial.gov.uk,+44 345 410 2222,Primary: Stericycle Inc.; Secondary: Regional subcontractors,Agency issued corrective action to incumbent — replacement opportunity,Paper timesheets — digital workforce management opportunity,"$50,000/mo",WATCH — 90+ Days,2026-05-29,Prime Pathwy Procurement Intelligence Engine v2.0
PROC-02317,City of Toronto — Purchasing and Materials Management,Municipal,"Toronto, ON",CA,Pest Control & Sanitation Services — City of Toronto,Pest Control & Sanitation,561710,"$300,000–$500,000",ABM Industries Inc.,1 Year,2026-07-30,2026-11-14,2027-10-16,2025-12-02,"RFP Response, ISO 9001 Certification, Environmental Compliance Documentation",https://www.toronto.ca/business-economy/doing-business-with-the-city/purchasing-and-materials-management/,purchasing@toronto.ca,+1 (416) 392-7312,Primary: ABM Industries Inc.; Secondary: Regional subcontractors,Contract approaching renewal — 90-day window to position,Manual contract renewal tracking — automated renewal system opportunity,"$25,000/mo",HIGH — Prepare in 30 Days,2026-05-29,Prime Pathwy Procurement Intelligence Engine v2.0
PROC-02318,Transport for London (TfL) — Procurement,Transit,"London, ENG",UK,Transportation & Logistics Services — Transport for London (TfL),Transportation & Logistics,493110,"$10,000,000–$25,000,000",Republic Services Inc.,1 Year + 4 Options,2026-09-17,2026-11-12,2028-02-05,2025-04-07,"SOQ (Statement of Qualifications), MWBE Certification, Safety Record, Insurance",https://tfl.gov.uk/info-for/suppliers/,procurement@tfl.gov.uk,+44 343 222 1234,Primary: Republic Services Inc.; Secondary: Regional subcontractors,Contract approaching renewal — 90-day window to position,Manual route optimization for service delivery — AI routing saves 20% fuel cost,"$50,000/mo",HIGH — Prepare in 30 Days,2026-05-29,Prime Pathwy Procurement Intelligence Engine v2.0
PROC-02319,AusTender — Australian Government Procurement,Federal,"Canberra, ACT",AU,Professional Consulting Services — AusTender,Consulting & Professional Services,562111,"$150,000–$300,000",CACI International,5 Years,2026-08-31,2026-10-03,2026-09-09,2024-07-18,"Bid Bond (5%), Performance Bond (100%), Payment Bond (100%), NAICS Certification",https://www.tenders.gov.au,austender@finance.gov.au,+61 2 6215 2222,Primary: CACI International; Secondary: Regional subcontractors,Incumbent contract expires with no renewal option — open competition,Manual scheduling of recurring services — automation ROI 300%+,"$50,000/mo",MEDIUM — 60-Day Pipeline,2026-05-29,Prime Pathwy Procurement Intelligence Engine v2.0
