State,Regime,Interest / Return (statutory),Redemption Period,Core Sale Mechanics,Notes (2025)
Alabama,Lien,12% simple/yr on redemption,3 years,County tax lien sale; premium bidding common,State-held liens available; deed after 3yrs via probate judge
Arizona,Lien,Bid-down from 16% simple/yr,3 years,Annual Feb sale; lowest interest wins,0% bids possible in some counties; admin or judicial foreclosure after window
Florida,Lien -> Deed,Bid-down to 0.25% steps; 5% minimum return on redemption,2 years (to apply for deed),May–June certificate sale; later deed sale if application filed,"Statutes §197.172, §197.432, §197.472"
Georgia,Deed (redeemable),20% premium for first year; +10% each additional year,1 year (can foreclose right after),First Tuesday sales; highest bid wins,Quiet title recommended before resale
California,Deed,N/A (deed sale),5 years (or 3 for nuisance properties) before sale,County tax-defaulted land auctions to highest bid,Right of redemption ends day before sale
Texas,Deed (redeemable),25% penalty in first year; 50% in second (homestead/ag); 6 months/25% others,6 months or 2 years depending on class,Constable/sheriff sales; deed issued; redemption penalties,Check local rules and excess proceeds
