source_content_type,link_to_type,link_to_id,link_purpose,placement,notes
LinkedIn Authority Post,Newsletter,NL-001,Drive email list growth,Post CTA,Use 'Full breakdown in this week's newsletter'
Newsletter,Whitepaper,WP-001,"Deepen authority, drive downloads",Body paragraph,Embed as gated PDF link
Operational Breakdown,Client Education Sequence,CE-001,Nurture toward consultation,End of post,Link to email sequence landing page
Local Market Insight,Industry Report,IR-001,Validate with data,Body paragraph,Cite report as source
Founder Narrative,LinkedIn Authority Post,PP-0001,Build personal brand continuity,Author bio,Link to most recent authority post
Whitepaper,Operational Breakdown,PP-0301,Provide tactical depth,References section,Link to 3 related breakdowns
Industry Report,Newsletter,NL-005,Drive newsletter subscriptions,Report footer,Subscribe CTA with report preview
